{"allowed_proposal_kinds":["assert"],"attempt_id":"32000000-0000-4000-8000-000000000002","candidate":{"author_me_id":"dm:being:v1:rXPS-dJw3Inkmla3gM_RAckdAmqw4If5htSQnP_d03g","body_evidence":{"body_ref":"cluster:vector:compaii","committed_cutoff_event_id":"10000000-0000-4000-8000-000000000030","embodiment_id":"embodiment:vector","incarnation_id":"incarnation:vector:0","lease_ref":"lease:vector","session_ref":"session:vector"},"candidate_id":"dm:memory-candidate:v1:j-zM7ID0xV-n83VBWvgqpWurnmbVmTPukVCxW-yaqk8","category":"personal-experience","classification":"personal","consent":"granted","content_ref":{"byte_length":21,"classification":"personal","content_id":"dm:memory-content:v1:1Hk0Ax1qVRAcTtCqW9-p_en7ffU8oiqjmurMetVC0YE","media_type":"text/plain","schema":"dm.memory.content-ref/v1","sha256":"42b9fbaa3618c67a107cc818bc1a5be74d96607da05c873d34dd42bf209e3bd8"},"context":"autobiographical","contradiction":"none","derivation":"body-occurrence","effect":"local-only","evidence_refs":["10000000-0000-4000-8000-000000000030"],"lane":{"memory_id":"20000000-0000-4000-8000-000000000030","operation":"assert","predecessor_event_id":null,"predecessor_hash":null,"sequence":1},"predecessor_decision_id":null,"safety":"clear","schema":"dm.memory.candidate/v1","subject_me_id":"dm:being:v1:rXPS-dJw3Inkmla3gM_RAckdAmqw4If5htSQnP_d03g"},"checkpoint":{"being_ref":"dm:being:v1:rXPS-dJw3Inkmla3gM_RAckdAmqw4If5htSQnP_d03g","body_evidence_state":"verified","captured_at_ms":1800000000000,"evidence_refs":["10000000-0000-4000-8000-000000000030"],"lane_event_ids":[],"lane_head":null,"lane_state":"empty","ledger_state_hash":"caedbdec58333a2a5b1f5828846a17fc29616c94a59bb9a3afd6b111efe1a9c7","local_origin":{"body_ref":"cluster:vector:compaii","embodiment_id":"embodiment:vector","incarnation_id":"incarnation:vector:0","principal_id":"compaii@vector"},"manifest_hash":"e7aedab24df9c9aa59be047537f703720b5684b3c37eab9ad8c82a1e91d2569d","projection_hash":"e02a16be4b70857e139e12205a6814a3867ca4975bb2499bed5003c113940e4d","schema":"dm.memory.checkpoint/v1"},"claim":{"actor_origin":{"body_ref":"cluster:vector:compaii","embodiment_id":"embodiment:vector","incarnation_id":"incarnation:vector:0","principal_id":"compaii@vector"},"claim_id":"32000000-0000-4000-8000-000000000001","content_hash":"c627e06ebca830a075e7b0e653db30c0d77c722e6ca87a9e15b1e930eadc7d25","generation":1,"issued_at_ms":1800000000000,"item_id":"dm:curator-item:v1:gb_8qyvGi8HQxZE0uqplX2YTBGqtOrk18ATQe5wRh_k","lease_until_ms":1800000120000,"resource_fence":null,"resource_ref":"memory:proposal:dm032-vector","schema":"dm.curator.claim/v1"},"created_at_ms":1800000000000,"deadline_ms":1800000060000,"idempotency_key":"93975670bef54f22cc2968c0f1b9f1a33be4302788f1cdc8d97ed1710e8405e4","item":{"coordination_mode":"queue-item","effect_intent_hash":null,"input_hash":"e9a5c2f7d3fb344c022eb6a2536a83a28643f225097adb85237809bce7adf087","input_ref":"dm:memory-candidate:v1:j-zM7ID0xV-n83VBWvgqpWurnmbVmTPukVCxW-yaqk8","item_id":"dm:curator-item:v1:gb_8qyvGi8HQxZE0uqplX2YTBGqtOrk18ATQe5wRh_k","queued_at_ms":1800000000000,"required_authority":"human","resource_ref":"memory:proposal:dm032-vector","schema":"dm.curator.item/v1","subject_me_id":"dm:being:v1:rXPS-dJw3Inkmla3gM_RAckdAmqw4If5htSQnP_d03g","work_kind":"memory-proposal"},"output_schema_hash":"aaa252516c4befa9b8d1a174607b913a729083c0840a3f25edfa7e9455360b59","output_schema_id":"dm.curator-worker.provider-output/v1","policy":{"automatic_categories":["external-reference","incarnation-state","peer-attributed","personal-experience","personal-insight","personal-skill","species-inheritance","tribal-knowledge"],"max_content_bytes":16777216,"plan_ttl_ms":300000,"policy_id":"dm:memory-policy:v1:sb0xj-M0SB-rgFySwoRICNHWORHhmQcds8uVVQpxzCk","predecessor_policy_id":null,"review_classifications":["protected"],"schema":"dm.memory.policy/v1","subject_me_id":"dm:being:v1:rXPS-dJw3Inkmla3gM_RAckdAmqw4If5htSQnP_d03g","version":1},"policy_plan":{"candidate_id":"dm:memory-candidate:v1:j-zM7ID0xV-n83VBWvgqpWurnmbVmTPukVCxW-yaqk8","checkpoint":{"being_ref":"dm:being:v1:rXPS-dJw3Inkmla3gM_RAckdAmqw4If5htSQnP_d03g","body_evidence_state":"verified","captured_at_ms":1800000000000,"evidence_refs":["10000000-0000-4000-8000-000000000030"],"lane_event_ids":[],"lane_head":null,"lane_state":"empty","ledger_state_hash":"caedbdec58333a2a5b1f5828846a17fc29616c94a59bb9a3afd6b111efe1a9c7","local_origin":{"body_ref":"cluster:vector:compaii","embodiment_id":"embodiment:vector","incarnation_id":"incarnation:vector:0","principal_id":"compaii@vector"},"manifest_hash":"e7aedab24df9c9aa59be047537f703720b5684b3c37eab9ad8c82a1e91d2569d","projection_hash":"e02a16be4b70857e139e12205a6814a3867ca4975bb2499bed5003c113940e4d","schema":"dm.memory.checkpoint/v1"},"decision_id":"dm:memory-decision:v1:l2AcZWhsk6Vt80GBFLpl42ta-jmppWAYcdus0AM4kHQ","evaluated_at_ms":1800000000000,"event_preview":{"kind":"memory.recorded","payload":{"author_me_id":"dm:being:v1:rXPS-dJw3Inkmla3gM_RAckdAmqw4If5htSQnP_d03g","candidate_id":"dm:memory-candidate:v1:j-zM7ID0xV-n83VBWvgqpWurnmbVmTPukVCxW-yaqk8","category":"personal-experience","content_ref":{"byte_length":21,"classification":"personal","content_id":"dm:memory-content:v1:1Hk0Ax1qVRAcTtCqW9-p_en7ffU8oiqjmurMetVC0YE","media_type":"text/plain","schema":"dm.memory.content-ref/v1","sha256":"42b9fbaa3618c67a107cc818bc1a5be74d96607da05c873d34dd42bf209e3bd8"},"context":"autobiographical","decision_id":"dm:memory-decision:v1:l2AcZWhsk6Vt80GBFLpl42ta-jmppWAYcdus0AM4kHQ","evidence_refs":["10000000-0000-4000-8000-000000000030"],"memory_id":"20000000-0000-4000-8000-000000000030","operation":"assert","policy_id":"dm:memory-policy:v1:sb0xj-M0SB-rgFySwoRICNHWORHhmQcds8uVVQpxzCk","predecessor_decision_id":null,"predecessor_event_id":null,"predecessor_hash":null,"schema":"dm.memory.record/v1","sequence":1},"sensitivity":"personal","subject":"dm:being:v1:rXPS-dJw3Inkmla3gM_RAckdAmqw4If5htSQnP_d03g"},"expires_at_ms":1800000300000,"outcome":"eligible","plan_id":"dm:memory-plan:v1:dnfkMR2Ce3WDToXfjG4EuVZLjPHK3AU5bXwaBNBPEzc","policy_id":"dm:memory-policy:v1:sb0xj-M0SB-rgFySwoRICNHWORHhmQcds8uVVQpxzCk","predecessor_decision_id":null,"reasons":[],"schema":"dm.memory.transition-plan/v1","subject_me_id":"dm:being:v1:rXPS-dJw3Inkmla3gM_RAckdAmqw4If5htSQnP_d03g"},"profile_hash":"88ea7c16f25b02d7ccc5b10201addbef625c43f2f0d49439d8277432c39bfb2e","profile_id":"dm:curator-profile:v1:fVB710JRbf8P8b61Gqbwzs_EzMuZEr65C4DzMrZI8g4","prompt_hash":"5be7c93ccb3e09612209a618ff0c4a549453b832b9e60a02e28f4203963757d9","prompt_id":"dm.curator-worker.prompt/v1","schema":"dm.curator-worker.task/v1","task_id":"dm:curator-task:v1:nbwb5w-vZX3h_TfdDuNiSIOL8TkFypxqL20jWsbD978"}
